{
    "$schema": "../vinv.json",
    "v": "0.1-alpha",
    "trees": [
        {
            "fddd":[
                [[23.4444441,23.4444441], 12],
                "34_",
                23,12, 
                [[0.5,5], [0.3,5]],
                [[0.3,5], [0.6,5]],
                "2018-11-13",
                null
            ],
            "sdfsdfs":[
                [[23.4444441,23.4444441, 0], 12],
                "34_",
                23,
                12, 
                [[0.3,5], [0.6,5]],
                [[0.3,5], [0.6,5]],
                "2018-11-13",
                null
            ]
        }
    ],
    "tracks": [
        {
            "sdfsdfd":[
                [
                    [
                        [23.56,23.222]
                    ],
                    [
                        [23.56,23.222, 0],
                        49.83
                    ],
                    [
                        [23.56,23.222, 0],
                        40.44
                    ],
                    [
                        [23.56,23.222, 0],
                        36.59
                    ],
                    [
                        [23.56,23.222, 0],
                        32.24
                    ]
                ],
                5.6
            ]
        }
    ],
    "areas": [
        {
            "sdfsdfd":[
                [
                    [
                        [
                            [23.56,23.222]
                        ],
                        [
                            [23.56,23.222, 0],
                            23
                        ],
                        [
                            [23.56,23.222, 0],
                            40.44
                        ],
                        [
                            [23.56,23.222, 0],
                            36.59
                        ],
                        [
                            [23.56,23.222, 0],
                            32.24
                        ]
                    ]
                ],
                "dsfsdf"
            ]
        }
    ]
}