{
    "$schema": "../../dist/0.1-alpha.json",
    "v": "0.1-alpha",
    "trees": [
        {
            "fddd": [
                [
                    [
                        13.96727085113525,
                        47.39515368316963
                    ],
                    12
                ],
                "34_",
                23,
                12,
                [
                    [
                        0.5,
                        5
                    ],
                    [
                        0.3,
                        5
                    ]
                ],
                [
                    [
                        0.3,
                        5
                    ],
                    [
                        0.6,
                        5
                    ]
                ],
                "2018-11-13",
                null
            ],
            "sdfsdfs": [
                [
                    [
                        13.969395160675049,
                        47.39474696708006,
                        0
                    ],
                    12
                ],
                "34_",
                23,
                12,
                [
                    [
                        0.3,
                        5
                    ],
                    [
                        0.6,
                        5
                    ]
                ],
                [
                    [
                        0.3,
                        5
                    ],
                    [
                        0.6,
                        5
                    ]
                ],
                "2018-11-13",
                null
            ]
        }
    ],
    "tracks": [
        {
            "road_1": [
                [
                    [
                        [
                            34,
                            34,
                            0
                        ],
                        0
                    ],
                    [
                        [
                            34,
                            34,
                            0
                        ],
                        34
                    ]
                ],
                9.4
            ]
        },
        []
    ],
    "areas": [
        {
            "sdfsdfd": [
                [
                    [
                        [
                            [
                                23.56,
                                23.222
                            ]
                        ],
                        [
                            [
                                23.56,
                                23.222,
                                0
                            ],
                            23
                        ],
                        [
                            [
                                23.56,
                                23.222,
                                0
                            ],
                            40.44
                        ],
                        [
                            [
                                23.56,
                                23.222,
                                0
                            ],
                            36.59
                        ],
                        [
                            [
                                23.56,
                                23.222,
                                0
                            ],
                            32.24
                        ]
                    ]
                ],
                "dsfsdf"
            ]
        }
    ]
}